### ISSUE TITLE
🐛两个 warp 节点可以 ping 通但是 tcp 流量不通

### ISSUE THREAD

**Issue by wjsw1781** [cloudflare/cloudflared#1548]
**Describe the bug**
我创建了两个 warp 节点 然后转换成 wiregard 节点 

一台部署到了香港100.96.0.28

interface: 100_96_0_28
  public key:********/UT0=
  private key: (hidden)
  listening port: 36958

peer: bmXOC+F1FxEMF9dyiK2H5/1SUtzH0JuVo51h2wPfgyo=
  endpoint: 162.159.193.6:2408
  allowed ips: 100.96.0.0/12, 2606:4700:cf1:1000::/64
  latest handshake: 1 minute, 24 seconds ago
  transfer: 5.40 KiB received, 235.24 KiB sent
  persistent keepalive: every 25 seconds

一台部署到了美国100.96.0.33
interface: 100_96_0_33
  public key:*******=
  private key: (hidden)
  listening port: 34305

peer: bmXOC+F1FxEMF9dyiK2H5/1SUtzH0JuVo51h2wPfgyo=
  endpoint: 162.159.193.3:2408
  allowed ips: 100.96.0.0/12, 2606:4700:cf1:1000::/64
  latest handshake: 2 seconds ago
  transfer: 92 B received, 180 B sent

他们是可以 ping 通信的 但是 tcp 无法路由和卡死

(base) root@iZj6cbhfxlamwuzf0aq83rZ:~/socks_ss_gfw_ss_socks/wg_one_2_many_peer# ping 100.96.0.33
PING 100.96.0.33 (100.96.0.33) 56(84) bytes of data.
64 bytes from 100.96.0.33: icmp_seq=1 ttl=62 time=344 ms
64 bytes from 100.96.0.33: icmp_seq=2 ttl=62 time=169 ms
64 bytes from 100.96.0.33: icmp_seq=3 ttl=62 time=170 ms
64 bytes from 100.96.0.33: icmp_seq=4 ttl=62 time=169 ms
^C
--- 100.96.0.33 ping statistics ---
5 packets transmitted, 4 received, 20% packet loss, time 4003ms
rtt min/avg/max/mdev = 168.655/212.690/343.770/75.679 ms

在100.96.0.33的 9898 端口运行了一个 socks5 服务, 然后我在100.96.0.28  进行curl -x socks5://100.96.0.33:9898 cip.cc 没有反应 但是流量都过去了 ,从100.96.0.28 和 100.96.0.33都能看到流量

curl -x socks5://100.96.0.33:9898 cip.cc

17:10:30.380086 100_96_0_28 Out ifindex 1863 ethertype IPv4 (0x0800), length 80: 100.96.0.28.37594 > 100.96.0.33.9898: Flags [S], seq 584721863, win 64860, options [mss 1380,sackOK,TS val 2074590469 ecr 0,nop,wscale 7], length 0
17:10:31.404084 100_96_0_28 Out ifindex 1863 ethertype IPv4 (0x0800), length 80: 100.96.0.28.37594 > 100.96.0.33.9898: Flags [S], seq 584721863, win 64860, options [mss 1380,sackOK,TS val 2074591493 ecr 0,nop,wscale 7], length 0
17:10:33.452069 100_96_0_28 Out ifindex 1863 ethertype IPv4 (0x0800), length 80: 100.96.0.28.37594 > 100.96.0.33.9898: Flags [S], seq 584721863, win 64860, options [mss 1380,sackOK,TS val 2074593541 ecr 0,nop,wscale 7], length 0
17:10:37.484083 100_96_0_28 Out ifindex 1863 ethertype IPv4 (0x0800), length 80: 100.96.0.28.37594 > 100.96.0.33.9898: Flags [S], seq 584721863, win 64860, options [mss 1380,sackOK,TS val 2074597573 ecr 0,nop,wscale 7], length 0
17:10:45.612085 100_96_0_28 Out ifindex 1863 ethertype IPv4 (0x0800), length 80: 100.96.0.28.37594 > 100.96.0.33.9898: Flags [S], seq 584721863, win 64860, options [mss 1380,sackOK,TS val 2074605701 ecr 0,nop,wscale 7], length 0
17:11:01.996111 100_96_0_28 Out ifindex 1863 ethertype IPv4 (0x0800), length 80: 100.96.0.28.37594 > 100.96.0.33.9898: Flags [S], seq 584721863, win 64860, options [mss 1380,sackOK,TS val 2074622085 ecr 0,nop,wscale 7], length 0
17:11:34.252216 100_96_0_28 Out ifindex 1863 ethertype IPv4 (0x0800), length 80: 100.96.0.28.37594 > 100.96.0.33.9898: Flags [S], seq 584721863, win 64860, options [mss 1380,sackOK,TS val 2074654341 ecr 0,nop,wscale 7], length 0

ons [mss 1460,sackOK,TS val 1298173493 ecr 0,nop,wscale 13], length 0
10:11:04.166543  In ethertype IPv4 (0x0800), length 76: 100.96.0.28.37594 > 100.96.0.33.9898: Flags [S], seq 3725157368, win 65535, options [mss 1460,sackOK,TS val 1298174517 ecr 0,nop,wscale 13], length 0
10:11:05.190361  In ethertype IPv4 (0x0800), length 76: 100.96.0.28.37594 > 100.96.0.33.9898: Flags [S], seq 3725157368, win 65535, options [mss 1460,sackOK,TS val 1298175541 ecr 0,nop,wscale 13], length 0
10:11:06.215436  In ethertype IPv4 (0x0800), length 76: 100.96.0.28.37594 > 100.96.0.33.9898: Flags [S], seq 3725157368, win 65535, options [mss 1460,sackOK,TS val 1298176566 ecr 0,nop,wscale 13], length 0
10:11:07.238553  In ethertype IPv4 (0x0800), length 76: 100.96.0.28.37594 > 100.96.0.33.9898: Flags [S], seq 3725157368, win 65535, options [mss 1460,sackOK,TS val 1298177589 ecr 0,nop,wscale 13], length 0
10:11:09.286299  In ethertype IPv4 (0x0800), length 76: 100.96.0.28.37594 > 100.96.0.33.9898: Flags [S], seq 3725157368, win 65535, options [mss 1460,sackOK,TS val 1298179637 ecr 0,nop,wscale 13], length 0

**To Reproduce**
1. Configure '...'
2. Run '....'
3. See error

If it's an issue with Cloudflare Tunnel:
4. Tunnel ID : 
5. cloudflared config: 

**Expected behavior**

**Environment and versions**
 - OS: [e.g. MacOS]
 - Architecture: [e.g. AMD, ARM]
 - Version: [e.g. 2022.02.0]

**Logs and errors**
If applicable, add logs or errors to help explain your problem.

**Additional context**

**Comment by wjsw1781** [comment]
My Question ; It is caused by the firewall
