### ISSUE TITLE
Failed to create quic connection and cause cloudflared container failed to run with 2022.4.0 on Docker

### ISSUE THREAD

**Issue by darth-pika-hu** [cloudflare/cloudflared#617]
Today, after updating the cloudflared docker from 2022.3.4 to 2022.4.0, the new quick protocol failed to connect to the server, causing the cloudflared docker container to self-destruct. 

The logs can be found here: 
```
2022-04-08T04:36:40Z INF Version 2022.4.0
2022-04-08T04:36:40Z INF GOOS: linux, GOVersion: go1.17.5, GoArch: amd64
2022-04-08T04:36:40Z INF Settings: map[no-autoupdate:true token:*****]
2022-04-08T04:36:40Z INF Generated Connector ID: d4bc3f69-ce1c-451a-af34-b688d50015f2
2022-04-08T04:36:40Z INF Will be fetching remotely managed configuration from Cloudflare API. Defaulting to protocol: quic
2022-04-08T04:36:40Z INF Initial protocol quic
2022-04-08T04:36:40Z INF Starting metrics server on 127.0.0.1:33206/metrics
2022-04-08T04:36:45Z ERR Failed to create new quic connection error="failed to dial to edge: timeout: no recent network activity" connIndex=0
2022-04-08T04:36:45Z ERR Serve tunnel error error="failed to dial to edge: timeout: no recent network activity" connIndex=0
...
2022-04-08T04:37:57Z INF Tunnel server stopped
2022-04-08T04:37:57Z INF Metrics server stopped
2022-04-08T04:37:57Z ERR Initiating shutdown error="failed to dial to edge: timeout: no recent network activity"
failed to dial to edge: timeout: no recent network activity

```

I attempted to create a new container with a 4.0 image, as well as to update from 3.4 to 4.0 within the 3.4 container, but neither worked. 

2022.3.4 is perfectly functional, because it just use the http2 protocol, 

If the quic protocol fails, I believe the right connection action is to fall back to http2, NOT keep trying 3 times then self-termination.

**Comment by nmldiegues** [comment]
Hello @darth-pika-hu 

You should be able to make `protocol quic` work by allowing egress UDP to 7844 on your docker infrastructure: https://developers.cloudflare.com/cloudflare-one/connections/connect-apps/configuration/ports-and-ips/

We are in the process of rolling out `quic` to everyone. In cases where it cannot connect, it fallsback to `http2`.

However, in your case, you are using a new Tunnel. I can tell that because of `Will be fetching remotely managed configuration from Cloudflare API. Defaulting to protocol: quic`
For new Tunnels, we have opted them into `quic` "forcefully" since the admin is much more likely to be on top of things and be willing to open UDP connectivity.

If for some reason you cannot really allow UDP egress, then you can still make it `http2` as per https://developers.cloudflare.com/cloudflare-one/connections/connect-apps/configuration/remote-management/

**Comment by darth-pika-hu** [comment]
I have read the docs and opened the 7844 port. And I tried on different machines and got the same results. To be honest, I think it is a bug.

**Comment by nmldiegues** [comment]
I absolutely understand the frustration @darth-pika-hu 

I can guarantee this is a problem with *your network* not allowing egress to 7844 UDP. 
E.g., this `docker run --rm -it docker.io/cloudflare/cloudflared:latest tunnel --hello-world` runs just fine from my infrastructure, and we can see thousand of other users that are doing the same just fine.

As noted above, you can force your Tunnel to run with `http2` even though it is managed in the UI (and the UI does not yet allow to control that). Check out https://developers.cloudflare.com/cloudflare-one/connections/connect-apps/configuration/remote-management/ for the details

Let me also reiterate on the reasoning behind this:  we're "forcing" quic protocol because we (Cloudflare) believe it is a big part of the future of the Internet. But many networks still block UDP. We must force admins behind those networks to feel that "pain" in some way, so that people are aware and begin allowing UDP egress.
E.g., our Private DNS resolution, which uses UDP, only works with QUIC protocol. So it is frustrating for users to spin up Tunnels defaulting to http2 (that does not support UDP proxying) and not have Private DNS resolution working (see https://developers.cloudflare.com/cloudflare-one/connections/connect-networks/private-net/private-hostnames-ips/#update-cloudflared)

**Comment by darth-pika-hu** [comment]
@nmldiegues Thank you for the reply. However, I have checked all the rules, and nothing blocking the 7844 port. I know how to use http2 but just want to give quic a chance. Then I found this article 
https://blog.cloudflare.com/getting-cloudflare-tunnels-to-connect-to-the-cloudflare-network-with-quic/
I don't know what to say. It's written by one of you guys. A similar situation and he/she found a bug. Why are you so sure it is my network issue and not a new bug?

**Comment by nmldiegues** [comment]
> A similar situation and he/she found a bug. Why are you so sure it is my network issue and not a new bug?

Because that blog post describes a past problem and how we solved it in our edge. That's why we have already so many QUIC tunnels connected to us. Otherwise they wouldn't be able to.


> However, I have checked all the rules, and nothing blocking the 7844 port

Maybe the problem is with your ISP. We never know...
You can use mtr (https://www.cloudflare.com/en-gb/learning/network-layer/what-is-mtr/) against region1.argotunnel.com port 7844 and compare TCP vs UDP

**Comment by darth-pika-hu** [comment]
@nmldiegues I definitely need your help here. I called AT&T today and made sure port 7844 was enabled both for UDP and TCP egress. Installed WinMTR and disabled the firewall. 


Here is the result for region1.argotunnel.com:

<html><body bgcolor="white">
<center><h2>region1.argotunnel.com</h2></center>
<p align="center"> <table border="1" align="center">
<tr><td>Host</td> <td>%</td> <td>Sent</td> <td>Recv</td> <td>Best</td> <td>Avrg</td> <td>Wrst</td> <td>Last</td></tr>
<tr><td>10.0.1.1</td> <td>   0</td> <td>  39</td> <td>  39</td> <td>   0</td> <td>   0</td> <td>   2</td> <td>   0</td></tr>
<tr><td>108-195-129-254.lightspeed.irvnca.sbcglobal.net</td> <td>   0</td> <td>  39</td> <td>  39</td> <td>   1</td> <td>   1</td> <td>   3</td> <td>   1</td></tr>
<tr><td>No response from host</td> <td> 100</td> <td>   7</td> <td>   0</td> <td>   0</td> <td>   0</td> <td>   0</td> <td>   0</td></tr>
<tr><td>75.29.48.90</td> <td>   0</td> <td>  39</td> <td>  39</td> <td>   2</td> <td>   2</td> <td>   4</td> <td>   2</td></tr>
<tr><td>12.242.115.44</td> <td>   0</td> <td>  39</td> <td>  39</td> <td>   4</td> <td>   8</td> <td>  13</td> <td>   7</td></tr>
<tr><td>192.205.37.146</td> <td>   0</td> <td>  39</td> <td>  39</td> <td>   6</td> <td>   8</td> <td>  21</td> <td>   7</td></tr>
<tr><td>No response from host</td> <td> 100</td> <td>   7</td> <td>   0</td> <td>   0</td> <td>   0</td> <td>   0</td> <td>   0</td></tr>
<tr><td>4.30.195.50</td> <td>  27</td> <td>  19</td> <td>  14</td> <td>   0</td> <td>  11</td> <td>  28</td> <td>   7</td></tr>
<tr><td>141.101.72.32</td> <td>   0</td> <td>  39</td> <td>  39</td> <td>   6</td> <td>   7</td> <td>  16</td> <td>   7</td></tr>
<tr><td>198.41.192.167</td> <td>   0</td> <td>  39</td> <td>  39</td> <td>   6</td> <td>   6</td> <td>   8</td> <td>   6</td></tr>
</table></body></html>

Here is the result for region2.argotunnel.com:

<html><body bgcolor="white">
<center><h2>region2.argotunnel.com</h2></center>
<p align="center"> <table border="1" align="center">
<tr><td>Host</td> <td>%</td> <td>Sent</td> <td>Recv</td> <td>Best</td> <td>Avrg</td> <td>Wrst</td> <td>Last</td></tr>
<tr><td>10.0.1.1</td> <td>   0</td> <td>  20</td> <td>  20</td> <td>   0</td> <td>   0</td> <td>   1</td> <td>   0</td></tr>
<tr><td>108-195-129-254.lightspeed.irvnca.sbcglobal.net</td> <td>   0</td> <td>  20</td> <td>  20</td> <td>   0</td> <td>   0</td> <td>   2</td> <td>   1</td></tr>
<tr><td>No response from host</td> <td> 100</td> <td>   4</td> <td>   0</td> <td>   0</td> <td>   0</td> <td>   0</td> <td>   0</td></tr>
<tr><td>75.29.48.90</td> <td>   0</td> <td>  20</td> <td>  20</td> <td>   1</td> <td>   2</td> <td>   3</td> <td>   2</td></tr>
<tr><td>12.242.115.44</td> <td>   0</td> <td>  20</td> <td>  20</td> <td>   4</td> <td>   7</td> <td>  11</td> <td>   7</td></tr>
<tr><td>192.205.37.146</td> <td>   0</td> <td>  20</td> <td>  20</td> <td>   5</td> <td>   7</td> <td>  17</td> <td>   6</td></tr>
<tr><td>ae1.13.ear2.SanDiego1.level3.net</td> <td>   0</td> <td>  20</td> <td>  20</td> <td>  11</td> <td>  11</td> <td>  13</td> <td>  12</td></tr>
<tr><td>64.156.196.174</td> <td>   0</td> <td>  20</td> <td>  20</td> <td>  13</td> <td>  13</td> <td>  15</td> <td>  14</td></tr>
<tr><td>198.41.200.13</td> <td>   0</td> <td>  20</td> <td>  20</td> <td>  11</td> <td>  11</td> <td>  13</td> <td>  11</td></tr>
</table></body></html>

Here is a random website result for comparison:
<html><body bgcolor="white">
<center><h2>random website</h2></center>
<p align="center"> <table border="1" align="center">
<tr><td>Host</td> <td>%</td> <td>Sent</td> <td>Recv</td> <td>Best</td> <td>Avrg</td> <td>Wrst</td> <td>Last</td></tr>
<tr><td>10.0.1.1</td> <td>   0</td> <td>  12</td> <td>  12</td> <td>   0</td> <td>   0</td> <td>   1</td> <td>   0</td></tr>
<tr><td>108-195-129-254.lightspeed.irvnca.sbcglobal.net</td> <td>   0</td> <td>  12</td> <td>  12</td> <td>   0</td> <td>   1</td> <td>   2</td> <td>   1</td></tr>
<tr><td>No response from host</td> <td> 100</td> <td>   3</td> <td>   0</td> <td>   0</td> <td>   0</td> <td>   0</td> <td>   0</td></tr>
<tr><td>75.29.48.90</td> <td>   0</td> <td>  12</td> <td>  12</td> <td>   1</td> <td>   2</td> <td>   3</td> <td>   2</td></tr>
<tr><td>12.242.115.44</td> <td>   0</td> <td>  12</td> <td>  12</td> <td>   5</td> <td>   8</td> <td>  11</td> <td>  11</td></tr>
<tr><td>192.205.37.146</td> <td>   0</td> <td>  12</td> <td>  12</td> <td>   5</td> <td>   6</td> <td>   9</td> <td>   6</td></tr>
<tr><td>No response from host</td> <td> 100</td> <td>   3</td> <td>   0</td> <td>   0</td> <td>   0</td> <td>   0</td> <td>   0</td></tr>
<tr><td>4.30.195.50</td> <td>  50</td> <td>   4</td> <td>   2</td> <td>   6</td> <td>  23</td> <td>  40</td> <td>   6</td></tr>
<tr><td>172.70.212.2</td> <td>   0</td> <td>  12</td> <td>  12</td> <td>   5</td> <td>   6</td> <td>  12</td> <td>   6</td></tr>
<tr><td>104.26.5.110</td> <td>   0</td> <td>  12</td> <td>  12</td> <td>   5</td> <td>   5</td> <td>   6</td> <td>   6</td></tr>
</table></body></html>

I am a little confused. It seems the data has no problem to reach the final destination. But once trying to use cloudflared windows version to establish QUIC connection, I got the same error message like Docker.

**Comment by darth-pika-hu** [comment]
@nmldiegues Okay. I just did something crazy, and I think it's something I should do at the start. Now I can say with certainty that the issue is most likely either with the Argo Tunnel server or something on Cloudflare side. I experimented with the cloudflared quic protocol on both my home and company servers. There was no joy. 

So, on one of the company's servers in the office, I set up an OpenVPN server (UDP protocol at port 7844). Then I try to connect to the VPN server in the office using the server at home that is having issues with cloudflared quic protocol connection. What do you think happened? Successful! This means that UDP and port 7844 are working properly on my network. The last thing that comes to mind is that the Argo Tunnel server may have a messed up network policy that prevents connections from my home and my company's IP addresses from being accepted.

**Comment by sudarshan-reddy** [comment]
@darth-pika-hu : Can you show us a tcpdump or OpenVPN logs that show traffic flowing as UDP?

Also tcpdumps of what happens when you’re trying to make QUIC connections with cloudflared will be useful.

Also, please give us detailed information about your environment. What’s your own network policy like? Do you have other network based processes running? Specific iptables/nftables rules?

I get that troubleshooting this must be frustrating. But as far as I can see, all our systems are accepting and proxying QUIC connections even as we speak.

**Comment by darth-pika-hu** [comment]
> Can you show us a tcpdump or OpenVPN logs that show traffic flowing as UDP?

How about the openvpn configuration:

```
dev tun
--
  | tls-client
  |  
  | remote 108.xxx.16.xx 7844 udp
```
As you can see, I forced 7844 udp.

> Also, please give us detailed information about your environment. What’s your own network policy like? Do you have other network based processes running? Specific iptables/nftables rules?

Well, to simplify the debug process, I directly connected a non-production server to the internet with a static IP at home. In the company, I connected a VM directly to the internet with a static IP too.  Both use 1.1.1.1 as DNS, with no rules. Simple and crazy.

**Comment by sudarshan-reddy** [comment]
This does not prove that the packets that left and received were actual UDP. It does not prove that your system is not dropping the packets. The best way to verify that is to look at actual packets. You quoted my blog post. If you see thats the first step of troubleshooting from my side. 

We do not have policy specific rules globally.  

We still do not have any details about what your environment is like. There isn’t much to go on here really except empirical description.

**Comment by darth-pika-hu** [comment]
It is beyond my comprehension. What if I set up a virtual machine for you and let you do whatever you need to do?

**Comment by darth-pika-hu** [comment]
@sudarshan-reddy Here is the tcpdump log while cloudflared trying to connect via QUIC:

```
listening on \Device\{4CA37862-9848-4728-9D2B-98465194344F}, link-type EN10MB (Ethernet), capture size 262144 bytes
11:48:25.201412 IP 10.0.1.213.61706 > 198.41.200.113.7844: UDP, length 1252
11:48:25.410162 IP 10.0.1.213.61706 > 198.41.200.113.7844: UDP, length 1252
11:48:25.410162 IP 10.0.1.213.61706 > 198.41.200.113.7844: UDP, length 1252
11:48:25.813411 IP 10.0.1.213.61706 > 198.41.200.113.7844: UDP, length 1252
11:48:25.813411 IP 10.0.1.213.61706 > 198.41.200.113.7844: UDP, length 1252
11:48:26.617403 IP 10.0.1.213.61706 > 198.41.200.113.7844: UDP, length 1252
11:48:26.617403 IP 10.0.1.213.61706 > 198.41.200.113.7844: UDP, length 1252
11:48:28.217673 IP 10.0.1.213.61706 > 198.41.200.113.7844: UDP, length 1252
11:48:28.217673 IP 10.0.1.213.61706 > 198.41.200.113.7844: UDP, length 1252
```
PS: using tcpdump on windows is a pain.

**Comment by nmldiegues** [comment]
We'll likely make a new release of cloudflared that fallsback to http2 from quic when this scenario happens. This is already the case normally when the quic protocol is picked automatically (and not configured by the user). We will make it so for Tunnels managed by the UI as well.

In practice we'll want to promote quic usage, but this likely will need some tool to help troubleshoot this sort of scenarios, which are time consuming, and for which we do not currently have bandwidth to attack.

**Comment by darth-pika-hu** [comment]
@nmldiegues Thank you for the update. We are on the same side. I am willing to adopt QUIC on my end and also want to help you guys. Just let me know.

**Comment by nmldiegues** [comment]
Thanks for all the iterations here. For now we'll go with 2022.4.1 cloudflared version that should backoff to http2 even for UI managed Tunnels as a workaround for this.

**Comment by darth-pika-hu** [comment]
@nmldiegues and @sudarshan-reddy Want to give you guys a heads up. QUIC starts working suddenly.

**Comment by nmldiegues** [comment]
> @nmldiegues and @sudarshan-reddy Want to give you guys a heads up. QUIC starts working suddenly. Update: stopped working again.

Well, we certainly haven't done anything over the weekend.

**Comment by darth-pika-hu** [comment]
> > @nmldiegues and @sudarshan-reddy Want to give you guys a heads up. QUIC starts working suddenly. Update: stopped working again.
> 
> Well, we certainly haven't done anything over the weekend.

Well, I didn't change anything too. And it is not during the weekend. It is last friday. Maybe check your server log?

**Comment by nmldiegues** [comment]
Can you share your Tunnel ID?
It's not a secret, no one can do anything with it on your behalf (but it allows us to look into it from our perspective)

**Comment by darth-pika-hu** [comment]
> Can you share your Tunnel ID?
> It's not a secret, no one can do anything with it on your behalf (but it allows us to look into it from our perspective)

Understand. Willing to help.
Here are the tunnel ID:
eaee69fd-5bd9-4807-9352-a912bf81fd26
a89ac8f5-c23c-417f-b18d-408de86e7a3a
298c57ed-965d-494b-81ef-eb608c69e254
3d089c3b-3b4f-401d-8b1d-b8b53699a85c

**Comment by nmldiegues** [comment]
Thanks for those.  I may have found something interesting, and we'll pursue it internally.

For now, the gist is that cloudflared connects to 2 data-centers (for reliability, 2 connections in each).  It looks like your cloudflared is unable to connect with QUIC to a specific data-center only.  Since the 12th of April I see many successful QUIC connections to various data-centers, but I see HTTP2 connections only to that one specific data-center.

So, it seems like you're using QUIC in 2 of the 4 connections. The logs that you see for falling back will generally be for connection index 0 and 2 (which connect to one anycast region), whereas connection index 1 and 3 will successfully connect with QUIC (to another anycast region).

**Comment by nmldiegues** [comment]
We've uncovered that a small number of data-centers was indeed having this problem where they would not take in QUIC connections. We'll fix that and post back, at which point all your connections (and not just half of them) should work with QUIC fine.

**Comment by darth-pika-hu** [comment]
> Thanks for those. I may have found something interesting, and we'll pursue it internally.
> 
> For now, the gist is that cloudflared connects to 2 data-centers (for reliability, 2 connections in each). It looks like your cloudflared is unable to connect with QUIC to a specific data-center only. Since the 12th of April I see many successful QUIC connections to various data-centers, but I see HTTP2 connections only to that one specific data-center.
> 
> So, it seems like you're using QUIC in 2 of the 4 connections. The logs that you see for falling back will generally be for connection index 0 and 2 (which connect to one anycast region), whereas connection index 1 and 3 will successfully connect with QUIC (to another anycast region).

Well. I was right.

**Comment by darth-pika-hu** [comment]
Update: today is 04/25; QUIC is working again for all my tunnels. Let's see how long they will last.

**Comment by nmldiegues** [comment]
> Update: today is 04/25; QUIC is working again for all my tunnels. Let's see how long they will last.

Yes, we actioned the changes in the very small subset) data centers that were not accepting QUIC as they should. So you should now have QUIC on all your 4 connections for good (not ephemerally).

**Comment by darth-pika-hu** [comment]
@nmldiegues Wonderful. QUIC for Cloudflare tunnel seems one step closer to its success. I wish you good luck with this project.

**Comment by befantasy** [comment]
I had the same problem.  Not all of the 4 connection was able to established with quic. 
Is there any way to force specify the datacenter which I connect to?

**Comment by befantasy** [comment]
> @nmldiegues Wonderful. QUIC for Cloudflare tunnel seems one step closer to its success. I wish you good luck with this project.

I had the same problem. Not all of the 4 connection was able to established with quic.
Is there any way to force specify the datacenter which I connect to?

**Comment by tleerai** [comment]
This is an epic case of RTFM gone wrong, heh. But hey, I get it.

**Comment by Kation** [comment]
@nmldiegues There still are some data-centers fail with quic

**Comment by DCCInterstellar** [comment]
> As noted above, you can force your Tunnel to run with `http2` even though it is managed in the UI (and the UI does not yet allow to control that). Check out https://developers.cloudflare.com/cloudflare-one/connections/connect-apps/configuration/remote-management/ for the details

I'm having this issue as well. My ISP is with T-Mobile Home Internet and sadly they don't offer quic. I went to the website you provided, however, this won't work with my Unraid System. By any chance does Cloudflare have an Unraid command to force the tunneling to use http2 instead of quic?

Thank you!!

**Comment by Kation** [comment]
@DCCInterstellar 
Publish Argument
tunnel --protocol http2 --no-autoupdate run --token xxx

**Comment by justin-himself** [comment]
> I absolutely understand the frustration @darth-pika-hu
> 
> I can guarantee this is a problem with _your network_ not allowing egress to 7844 UDP. E.g., this `docker run --rm -it docker.io/cloudflare/cloudflared:latest tunnel --hello-world` runs just fine from my infrastructure, and we can see thousand of other users that are doing the same just fine.
> 
> As noted above, you can force your Tunnel to run with `http2` even though it is managed in the UI (and the UI does not yet allow to control that). Check out https://developers.cloudflare.com/cloudflare-one/connections/connect-apps/configuration/remote-management/ for the details
> 
> Let me also reiterate on the reasoning behind this: we're "forcing" quic protocol because we (Cloudflare) believe it is a big part of the future of the Internet. But many networks still block UDP. We must force admins behind those networks to feel that "pain" in some way, so that people are aware and begin allowing UDP egress. E.g., our Private DNS resolution, which uses UDP, only works with QUIC protocol. So it is frustrating for users to spin up Tunnels defaulting to http2 (that does not support UDP proxying) and not have Private DNS resolution working (see https://developers.cloudflare.com/cloudflare-one/connections/connect-networks/private-net/private-hostnames-ips/#update-cloudflared)

I live in China and QUIC connections are constantly being blocked by my ISP and China firewall. I use cloudflare tunnel for the sole purpose to hide my traffic in other people's connections and QUIC had failed this purpose completely. QUIC had sure add to my pain on top of every other pain from living in China. Thanks a lot, appreciate it!

**Comment by justin-himself** [comment]
> @DCCInterstellar Publish Argument tunnel --protocol http2 --no-autoupdate run --token xxx

Thanks, it works!

I live in China and use cloudflare tunnel to hide my traffic amount other cloudflare users. QUIC completely fails this purpose as no other user connect to cloudflare in QUIC, so my connection was interrupted multiple times a day and I had to manually restart the container. By changing QUIC to http2, the problem is completely solved.

**Comment by amatteo78** [comment]
I have same problem with QUIC, I need it for route internet private network, fallback to https works but I can't use it for previus motivation.
This my log:
`2023-02-24T19:21:08Z INF Starting metrics server on 127.0.0.1:49927/metrics
2023-02-24T19:21:13Z ERR Failed to create new quic connection error="failed to dial to edge with quic: timeout: no recent network activity" connIndex=0 ip=198.41.192.37
2023-02-24T19:21:13Z INF Retrying connection in up to 2s connIndex=0 ip=198.41.192.37
2023-02-24T19:21:19Z ERR Failed to create new quic connection error="failed to dial to edge with quic: timeout: no recent network activity" connIndex=0 ip=198.41.192.107
2023-02-24T19:21:19Z INF Retrying connection in up to 4s connIndex=0 ip=198.41.192.107
2023-02-24T19:21:27Z ERR Failed to create new quic connection error="failed to dial to edge with quic: timeout: no recent network activity" connIndex=0 ip=198.41.192.227
2023-02-24T19:21:27Z INF Retrying connection in up to 8s connIndex=0 ip=198.41.192.227
2023-02-24T19:21:32Z ERR Failed to create new quic connection error="failed to dial to edge with quic: timeout: no recent network activity" connIndex=0 ip=198.41.200.73
2023-02-24T19:21:32Z INF Retrying connection in up to 16s connIndex=0 ip=198.41.200.73
2023-02-24T19:21:43Z ERR Failed to create new quic connection error="failed to dial to edge with quic: timeout: no recent network activity" connIndex=0 ip=198.41.192.167
2023-02-24T19:21:43Z INF Retrying connection in up to 32s connIndex=0 ip=198.41.192.167
2023-02-24T19:21:58Z ERR Failed to create new quic connection error="failed to dial to edge with quic: timeout: no recent network activity" connIndex=0 ip=198.41.192.37
2023-02-24T19:21:58Z INF Retrying connection in up to 1m4s connIndex=0 ip=198.41.192.37
2023-02-24T19:22:23Z ERR Failed to create new quic connection error="failed to dial to edge with quic: timeout: no recent network activity" connIndex=0 ip=198.41.200.233
2023-02-24T19:22:23Z INF Retrying connection in up to 1m4s connIndex=0 ip=198.41.200.233
2023-02-24T19:22:41Z ERR Failed to create new quic connection error="failed to dial to edge with quic: timeout: no recent network activity" connIndex=0 ip=198.41.200.53
2023-02-24T19:22:41Z INF Retrying connection in up to 1m4s connIndex=0 ip=198.41.200.53
2023-02-24T19:23:01Z ERR Failed to create new quic connection error="failed to dial to edge with quic: timeout: no recent network activity" connIndex=0 ip=198.41.200.73
2023-02-24T19:23:01Z INF Retrying connection in up to 1m4s connIndex=0 ip=198.41.200.73
2023-02-24T19:23:26Z WRN If this log occurs persistently, and cloudflared is unable to connect to Cloudflare Network with `quic` protocol, then most likely your machine/network is getting its egress UDP to port 7844 (or others) blocked or dropped. Make sure to allow egress connectivity as per https://developers.cloudflare.com/cloudflare-one/connections/connect-apps/configuration/ports-and-ips/
If you are using private routing to this Tunnel, then UDP (and Private DNS Resolution) will not work unless your cloudflared can connect with Cloudflare Network with `quic`. connIndex=0 ip=198.41.200.73
2023-02-24T19:23:26Z INF Switching to fallback protocol http2 connIndex=0 ip=198.41.200.73
2023-02-24T19:23:27Z INF Connection 0052f011-91d6-4a8b-a1e2-96b174ae8269 registered with protocol: http2 connIndex=0 ip=198.41.200.13 location=FCO
2023-02-24T19:23:27Z INF Connection 7243036b-689e-4774-9347-df7ccc4ac6db registered with protocol: http2 connIndex=1 ip=198.41.192.7 location=MXP
2023-02-24T19:23:27Z INF Warp-routing is enabled
2023-02-24T19:23:27Z INF Updated to new configuration config="{\"warp-routing\":{\"enabled\":true}}" version=1
2023-02-24T19:23:28Z INF Connection b88a9007-b4f4-4a75-9c07-1fb8a28d679a registered with protocol: http2 connIndex=2 ip=198.41.200.193 location=FCO
2023-02-24T19:23:30Z INF Connection 45bf6fc2-2a7d-4cb6-94bc-10ae8cb3044c registered with protocol: http2 connIndex=3 ip=198.41.192.27 location=MXP`

**Comment by zzduci** [comment]
> > @DCCInterstellar Publish Argument tunnel --protocol http2 --no-autoupdate run --token xxx
> 
> Thanks, it works!
> 
> I live in China and use cloudflare tunnel to hide my traffic amount other cloudflare users. QUIC completely fails this purpose as no other user connect to cloudflare in QUIC, so my connection was interrupted multiple times a day and I had to manually restart the container. By changing QUIC to http2, the problem is completely solved.

可以变成健康状态，但是退出这个命令cloudflared tunnel --protocol http2 --no-autoupdate run --token  <自己的token>之后，又变成了降级状态

**Comment by brpaz** [comment]
Same problem with `2023.05` version.
Here are my debug logs:

```
2023-05-13T13:53:12Z INF ICMP proxy will use 10.0.0.47 as source for IPv4
2023-05-13T13:53:12Z INF ICMP proxy will use fe80::ec90:adff:feb5:4a94 in zone eth0 as source for IPv6
2023-05-13T13:53:13Z DBG edge discovery: looking up edge SRV record domain=_v2-origintunneld._tcp.argotunnel.com event=0
2023-05-13T13:53:13Z DBG edge discovery: resolved edge addresses addresses=["198.41.192.227","198.41.192.7","198.41.192.27","198.41.192.107","198.41.192.47","198.41.192.57","198.41.192.37","198.41.192.67","198.41.192.167","198.41.192.77","2606:4700:a0::9","2606:4700:a0::1","2606:4700:a0::3","2606:4700:a0::4","2606:4700:a0::6","2606:4700:a0::5","2606:4700:a0::10","2606:4700:a0::7","2606:4700:a0::8","2606:4700:a0::2"] event=0
2023-05-13T13:53:13Z DBG edge discovery: resolved edge addresses addresses=["198.41.200.233","198.41.200.33","198.41.200.113","198.41.200.23","198.41.200.13","198.41.200.43","198.41.200.53","198.41.200.63","198.41.200.193","198.41.200.73","2606:4700:a8::4","2606:4700:a8::6","2606:4700:a8::9","2606:4700:a8::1","2606:4700:a8::5","2606:4700:a8::7","2606:4700:a8::10","2606:4700:a8::8","2606:4700:a8::3","2606:4700:a8::2"] event=0
2023-05-13T13:53:17Z INF Starting metrics server on [::]:2000/metrics
2023-05-13T13:53:17Z DBG edge discovery: looking up edge SRV record domain=_v2-origintunneld._tcp.argotunnel.com event=0
2023-05-13T13:53:18Z DBG edge discovery: resolved edge addresses addresses=["198.41.192.67","198.41.192.227","198.41.192.37","198.41.192.47","198.41.192.107","198.41.192.77","198.41.192.167","198.41.192.27","198.41.192.7","198.41.192.57","2606:4700:a0::5","2606:4700:a0::6","2606:4700:a0::4","2606:4700:a0::2","2606:4700:a0::8","2606:4700:a0::9","2606:4700:a0::7","2606:4700:a0::10","2606:4700:a0::3","2606:4700:a0::1"] event=0
2023-05-13T13:53:18Z DBG edge discovery: resolved edge addresses addresses=["198.41.200.193","198.41.200.73","198.41.200.33","198.41.200.13","198.41.200.63","198.41.200.233","198.41.200.53","198.41.200.23","198.41.200.113","198.41.200.43","2606:4700:a8::4","2606:4700:a8::1","2606:4700:a8::9","2606:4700:a8::2","2606:4700:a8::6","2606:4700:a8::5","2606:4700:a8::8","2606:4700:a8::3","2606:4700:a8::7","2606:4700:a8::10"] event=0
2023-05-13T13:53:18Z DBG edge discovery: giving new address to connection connIndex=0 event=0 ip=198.41.200.113
2023/05/13 13:53:18 failed to sufficiently increase receive buffer size (was: 208 kiB, wanted: 2048 kiB, got: 416 kiB). See https://github.com/lucas-clemente/quic-go/wiki/UDP-Receive-Buffer-Size for details.
2023-05-13T13:53:24Z ERR Failed to create new quic connection error="failed to dial to edge with quic: timeout: no recent network activity" connIndex=0 event=0 ip=198.41.200.113
2023-05-13T13:53:24Z DBG edge discovery: giving new address to connection available=19 connIndex=0 event=0 ip=198.41.200.233
2023-05-13T13:53:24Z INF Retrying connection in up to 2s connIndex=0 event=0 ip=198.41.200.113
2023-05-13T13:53:24Z DBG edge discovery: returning same edge address back to pool connIndex=0 event=0 ip=198.41.200.233
2023-05-13T13:53:29Z ERR Failed to create new quic connection error="failed to dial to edge with quic: timeout: no recent network activity" connIndex=0 event=0 ip=198.41.200.233
2023-05-13T13:53:29Z DBG edge discovery: giving new address to connection available=19 connIndex=0 event=0 ip=198.41.200.53
2023-05-13T13:53:29Z INF Retrying connection in up to 4s connIndex=0 event=0 ip=198.41.200.233
2023-05-13T13:53:31Z DBG edge discovery: returning same edge address back to pool connIndex=0 event=0 ip=198.41.200.5
```

**Comment by DCCInterstellar** [comment]
Failed to serve quic connection 

What is quic connection? Quic is a new encrypted transport layer network protocol that makes HTTP traffic more secure, efficient, and faster. However, there are certain ISP's do not support this protocol, which can interfere with your Cloudflare Tunneling.

There is a HIGH possibility that your ISP *doesn't support this and your tunnel will continue to have these errors. To fix this error, there are two options.

OPTION 1: If your Cloudflared Template is using the latest Repository like below.

cloudflare/cloudflared:latest

Please, add another Variable. 
Add a name of your liking for the Variable.

Key: TUNNEL_TRANSPORT_PROTOCOL

There are four different values you can add, "auto, http2, h2mux, and quic." (choose one)
* The “auto” value will automatically configure the quic protocol. If cloudflared is unable to establish connections with quic connection, it will fallback to using the http2 protocol. However, if you use auto as a value you will still get the Failed to serve quic connection error. This is a default function in cloudflared docker app. Use this value if your ISP supports quic connection. This runs on UDP (User Datagram Protocol). 
* The “http2” value is the standard protocol that all ISP's uses. It runs on TCP.

* The “h2mux” value is an unknown protocol that was used by cloudflared. Outdated.

In our case, we will be using the “http2” protocol to fix the quic connection error.
​

Once has been added. Restart the Container. The quic connection error should be resolved. 

OPTION 2: In Cloudflared Template, change the Repository to:

 cloudflare/cloudflared:2022.3.4

By changing this you will downgrade the Cloudflared Docker Container to 2022.3.4 version. It will use the http2 protocol but won't have the latest security patches for the tunnel. Recommend using the latest version.

**Comment by DCCInterstellar** [comment]
> Same problem with `2023.05` version.
> 
> Here are my debug logs:
> 
> 
> 
> ```
> 
> 2023-05-13T13:53:12Z INF ICMP proxy will use 10.0.0.47 as source for IPv4
> 
> 2023-05-13T13:53:12Z INF ICMP proxy will use fe80::ec90:adff:feb5:4a94 in zone eth0 as source for IPv6
> 
> 2023-05-13T13:53:13Z DBG edge discovery: looking up edge SRV record domain=_v2-origintunneld._tcp.argotunnel.com event=0
> 
> 2023-05-13T13:53:13Z DBG edge discovery: resolved edge addresses addresses=["198.41.192.227","198.41.192.7","198.41.192.27","198.41.192.107","198.41.192.47","198.41.192.57","198.41.192.37","198.41.192.67","198.41.192.167","198.41.192.77","2606:4700:a0::9","2606:4700:a0::1","2606:4700:a0::3","2606:4700:a0::4","2606:4700:a0::6","2606:4700:a0::5","2606:4700:a0::10","2606:4700:a0::7","2606:4700:a0::8","2606:4700:a0::2"] event=0
> 
> 2023-05-13T13:53:13Z DBG edge discovery: resolved edge addresses addresses=["198.41.200.233","198.41.200.33","198.41.200.113","198.41.200.23","198.41.200.13","198.41.200.43","198.41.200.53","198.41.200.63","198.41.200.193","198.41.200.73","2606:4700:a8::4","2606:4700:a8::6","2606:4700:a8::9","2606:4700:a8::1","2606:4700:a8::5","2606:4700:a8::7","2606:4700:a8::10","2606:4700:a8::8","2606:4700:a8::3","2606:4700:a8::2"] event=0
> 
> 2023-05-13T13:53:17Z INF Starting metrics server on [::]:2000/metrics
> 
> 2023-05-13T13:53:17Z DBG edge discovery: looking up edge SRV record domain=_v2-origintunneld._tcp.argotunnel.com event=0
> 
> 2023-05-13T13:53:18Z DBG edge discovery: resolved edge addresses addresses=["198.41.192.67","198.41.192.227","198.41.192.37","198.41.192.47","198.41.192.107","198.41.192.77","198.41.192.167","198.41.192.27","198.41.192.7","198.41.192.57","2606:4700:a0::5","2606:4700:a0::6","2606:4700:a0::4","2606:4700:a0::2","2606:4700:a0::8","2606:4700:a0::9","2606:4700:a0::7","2606:4700:a0::10","2606:4700:a0::3","2606:4700:a0::1"] event=0
> 
> 2023-05-13T13:53:18Z DBG edge discovery: resolved edge addresses addresses=["198.41.200.193","198.41.200.73","198.41.200.33","198.41.200.13","198.41.200.63","198.41.200.233","198.41.200.53","198.41.200.23","198.41.200.113","198.41.200.43","2606:4700:a8::4","2606:4700:a8::1","2606:4700:a8::9","2606:4700:a8::2","2606:4700:a8::6","2606:4700:a8::5","2606:4700:a8::8","2606:4700:a8::3","2606:4700:a8::7","2606:4700:a8::10"] event=0
> 
> 2023-05-13T13:53:18Z DBG edge discovery: giving new address to connection connIndex=0 event=0 ip=198.41.200.113
> 
> 2023/05/13 13:53:18 failed to sufficiently increase receive buffer size (was: 208 kiB, wanted: 2048 kiB, got: 416 kiB). See https://github.com/lucas-clemente/quic-go/wiki/UDP-Receive-Buffer-Size for details.
> 
> 2023-05-13T13:53:24Z ERR Failed to create new quic connection error="failed to dial to edge with quic: timeout: no recent network activity" connIndex=0 event=0 ip=198.41.200.113
> 
> 2023-05-13T13:53:24Z DBG edge discovery: giving new address to connection available=19 connIndex=0 event=0 ip=198.41.200.233
> 
> 2023-05-13T13:53:24Z INF Retrying connection in up to 2s connIndex=0 event=0 ip=198.41.200.113
> 
> 2023-05-13T13:53:24Z DBG edge discovery: returning same edge address back to pool connIndex=0 event=0 ip=198.41.200.233
> 
> 2023-05-13T13:53:29Z ERR Failed to create new quic connection error="failed to dial to edge with quic: timeout: no recent network activity" connIndex=0 event=0 ip=198.41.200.233
> 
> 2023-05-13T13:53:29Z DBG edge discovery: giving new address to connection available=19 connIndex=0 event=0 ip=198.41.200.53
> 
> 2023-05-13T13:53:29Z INF Retrying connection in up to 4s connIndex=0 event=0 ip=198.41.200.233
> 
> 2023-05-13T13:53:31Z DBG edge discovery: returning same edge address back to pool connIndex=0 event=0 ip=198.41.200.5
> 
> ```

Failed to serve quic connection 

What is quic connection? Quic is a new encrypted transport layer network protocol that makes HTTP traffic more secure, efficient, and faster. However, there are certain ISP's do not support this protocol, which can interfere with your Cloudflare Tunneling.

There is a HIGH possibility that your ISP *doesn't support this and your tunnel will continue to have these errors. To fix this error, there are two options.

OPTION 1: If your Cloudflared Template is using the latest Repository like below.

cloudflare/cloudflared:latest

Please, add another Variable. 
Add a name of your liking for the Variable.

Key: TUNNEL_TRANSPORT_PROTOCOL

There are four different values you can add, "auto, http2, h2mux, and quic." (choose one)
* The “auto” value will automatically configure the quic protocol. If cloudflared is unable to establish connections with quic connection, it will fallback to using the http2 protocol. However, if you use auto as a value you will still get the Failed to serve quic connection error. This is a default function in cloudflared docker app. Use this value if your ISP supports quic connection. This runs on UDP (User Datagram Protocol). 
* The “http2” value is the standard protocol that all ISP's uses. It runs on TCP.
* The “h2mux” value is an unknown protocol that was used by cloudflared. Outdated.

In our case, we will be using the “http2” protocol to fix the quic connection error.
​

Once has been added. Restart the Container. The quic connection error should be resolved. 

OPTION 2: In Cloudflared Template, change the Repository to:

 cloudflare/cloudflared:2022.3.4

By changing this you will downgrade the Cloudflared Docker Container to 2022.3.4 version. It will use the http2 protocol but won't have the latest security patches for the tunnel. Recommend using the latest version.

**Comment by mailinglists35** [comment]
still seeing this with latest release as of today. arm64 deb on ubuntu 16.04lts (yeah i know... it's an odroid c2 device, cannot easily upgrade it, but hey thanks for making the daemon compatible with it!)

`cloudflared tunnel --protocol http2 --url http://localhost:8000/`
working connector id: `f21ac8bc-e89e-4c94-9390-ac0140b96e65`

`cloudflared tunnel --url http://localhost:8000/`
failing connector id: `2b478358-9ac5-408d-86c4-16d63064cbe9`

`netcat` does connect to any of target servers but it does with some delay, it does not happen instantly. maybe the connector gives up prematurely?

here's an example:
````
2024-03-22T23:55:41Z ERR Failed to create new quic connection error="failed to dial to edge with quic: timeout: handshake did not complete in time" connIndex=0 event=0 ip=198.41.200.193
2024-03-22T23:55:41Z INF Retrying connection in up to 1m4s connIndex=0 event=0 ip=198.41.200.193
````

````
$ date; echo quit | nc -v -u -q 1 198.41.200.23 7844; date
Sat Mar 23 02:59:00 +03 2024
Connection to 198.41.200.23 7844 port [udp/*] succeeded!
Sat Mar 23 02:59:04 +03 2024
````

**Comment by CDSFounder** [comment]
Hi all, what is the latest on this? I am trying to get UDP packets to work on Cloudflare WARP (Cloudfared) and I understand that it must use the QUIC protocol for this to work.

When I force the QUIC protocol, i get the following errors in the event log:
`2024-09-09T02:24:59Z INF Starting tunnel tunnelID=0d23cb9a-b621-4a2e-8ddc-d7fb1b4b0d45
2024-09-09T02:24:59Z INF Version 2024.8.3
2024-09-09T02:24:59Z INF GOOS: windows, GOVersion: go1.22.2-devel-cf, GoArch: amd64
2024-09-09T02:24:59Z INF Settings: map[loglevel:debug p:auto protocol:auto token:*****]
2024-09-09T02:24:59Z INF cloudflared will not automatically update on Windows systems.
2024-09-09T02:24:59Z INF Generated Connector ID: 643f0835-be46-4ef0-be49-34788dfb5a17
2024-09-09T02:24:59Z DBG Fetched protocol: quic
2024-09-09T02:24:59Z INF Initial protocol quic
2024-09-09T02:24:59Z INF ICMP proxy will use 10.10.11.11 as source for IPv4
2024-09-09T02:24:59Z INF ICMP proxy will use fe80::281f:1330:df8f:4ecd in zone Ethernet 3 as source for IPv6
2024-09-09T02:24:59Z DBG edge discovery: looking up edge SRV record domain=_v2-origintunneld._tcp.argotunnel.com event=0
2024-09-09T02:24:59Z DBG edge discovery: resolved edge addresses addresses=["198.41.192.67","198.41.192.7","198.41.192.77","198.41.192.107","198.41.192.227","198.41.192.47","198.41.192.27","198.41.192.57","198.41.192.167","198.41.192.37"] event=0
2024-09-09T02:24:59Z DBG edge discovery: resolved edge addresses addresses=["198.41.200.53","198.41.200.233","198.41.200.73","198.41.200.113","198.41.200.193","198.41.200.13","198.41.200.33","198.41.200.63","198.41.200.23","198.41.200.43"] event=0
2024-09-09T02:24:59Z INF Starting metrics server on 127.0.0.1:59109/metrics
2024-09-09T02:24:59Z DBG edge discovery: looking up edge SRV record domain=_v2-origintunneld._tcp.argotunnel.com event=0
2024-09-09T02:24:59Z DBG edge discovery: resolved edge addresses addresses=["198.41.192.67","198.41.192.7","198.41.192.77","198.41.192.107","198.41.192.227","198.41.192.47","198.41.192.27","198.41.192.57","198.41.192.167","198.41.192.37"] event=0
2024-09-09T02:24:59Z DBG edge discovery: resolved edge addresses addresses=["198.41.200.53","198.41.200.233","198.41.200.73","198.41.200.113","198.41.200.193","198.41.200.13","198.41.200.33","198.41.200.63","198.41.200.23","198.41.200.43"] event=0
2024-09-09T02:24:59Z DBG edge discovery: giving new address to connection connIndex=0 event=0 ip=198.41.200.13
2024-09-09T02:25:04Z ERR Failed to create new quic connection error="failed to dial to edge with quic: timeout: no recent network activity" connIndex=0 event=0 ip=198.41.200.13
2024-09-09T02:25:04Z DBG edge discovery: giving new address to connection available=19 connIndex=0 event=0 ip=198.41.192.37
2024-09-09T02:25:04Z INF Retrying connection in up to 2s connIndex=0 event=0 ip=198.41.200.13
2024-09-09T02:25:06Z DBG edge discovery: returning same edge address back to pool connIndex=0 event=0 ip=198.41.192.37
2024-09-09T02:25:11Z ERR Failed to create new quic connection error="failed to dial to edge with quic: timeout: no recent network activity" connIndex=0 event=0 ip=198.41.192.37
2024-09-09T02:25:11Z DBG edge discovery: giving new address to connection available=19 connIndex=0 event=0 ip=198.41.200.33
2024-09-09T02:25:11Z INF Retrying connection in up to 4s connIndex=0 event=0 ip=198.41.192.37
2024-09-09T02:25:14Z DBG edge discovery: returning same edge address back to pool connIndex=0 event=0 ip=198.41.200.33
2024-09-09T02:25:19Z ERR Failed to create new quic connection error="failed to dial to edge with quic: timeout: no recent network activity" connIndex=0 event=0 ip=198.41.200.33
2024-09-09T02:25:19Z DBG edge discovery: giving new address to connection available=19 connIndex=0 event=0 ip=198.41.200.53
2024-09-09T02:25:19Z INF Retrying connection in up to 8s connIndex=0 event=0 ip=198.41.200.33
2024-09-09T02:25:22Z DBG edge discovery: returning same edge address back to pool connIndex=0 event=0 ip=198.41.200.53
2024-09-09T02:25:27Z ERR Failed to create new quic connection error="failed to dial to edge with quic: timeout: no recent network activity" connIndex=0 event=0 ip=198.41.200.53
2024-09-09T02:25:27Z DBG edge discovery: giving new address to connection available=19 connIndex=0 event=0 ip=198.41.200.73
2024-09-09T02:25:27Z INF Retrying connection in up to 16s connIndex=0 event=0 ip=198.41.200.53
2024-09-09T02:25:32Z DBG edge discovery: returning same edge address back to pool connIndex=0 event=0 ip=198.41.200.73
2024-09-09T02:25:37Z ERR Failed to create new quic connection error="failed to dial to edge with quic: timeout: no recent network activity" connIndex=0 event=0 ip=198.41.200.73
2024-09-09T02:25:37Z DBG edge discovery: giving new address to connection available=19 connIndex=0 event=0 ip=198.41.200.53
2024-09-09T02:25:37Z INF Retrying connection in up to 32s connIndex=0 event=0 ip=198.41.200.73`

We have all egress allowed - nothing should be blocking UDP. Any ideas what the real fix is here?

**Comment by Pikachews** [comment]
I get this issue if I am running Tailscale alongside cloudflared and have Tailscale connected to an exit node. Does this end up blocking QUIC from working? If I force it to use HTTP2 (or wait for it to fail enough times to fallback) everything seems to work, but I would rather use QUIC if that's possible but I also need to be connected to the Tailscale exit node.
